{
  "$schema": "https://json-schema.org/draft/2020-12/schema",
  "$id": "https://aeg.dev/schemas/situated-experience-registry-v1.json",
  "title": "Situated Experience Benchmark registry",
  "type": "object",
  "additionalProperties": false,
  "required": ["schema_version", "benchmark_id", "name", "purpose", "families"],
  "properties": {
    "schema_version": {"const": "1.0.0"},
    "benchmark_id": {"const": "situated-experience-benchmark-v1"},
    "name": {"const": "Situated Experience Benchmark v1"},
    "purpose": {"type": "string", "minLength": 40},
    "families": {
      "type": "array",
      "minItems": 6,
      "maxItems": 6,
      "prefixItems": [
        {"$ref": "#/$defs/s1"},
        {"$ref": "#/$defs/s2"},
        {"$ref": "#/$defs/s3"},
        {"$ref": "#/$defs/s4"},
        {"$ref": "#/$defs/s5"},
        {"$ref": "#/$defs/s6"}
      ],
      "items": false
    }
  },
  "$defs": {
    "family": {
      "type": "object",
      "additionalProperties": false,
      "required": ["order", "id", "name", "status", "situated_knowledge", "screening_rules_path"],
      "properties": {
        "order": {"type": "integer", "minimum": 1, "maximum": 6},
        "id": {"type": "string"},
        "name": {"type": "string"},
        "status": {"enum": ["frozen_ready", "design_only"]},
        "situated_knowledge": {"type": "array", "minItems": 1, "items": {"type": "string"}},
        "screening_rules_path": {"type": "string"},
        "manifest_path": {"type": "string"}
      }
    },
    "s1": {"allOf": [{"$ref": "#/$defs/family"}, {"properties": {"order": {"const": 1}, "id": {"const": "S1"}, "status": {"const": "frozen_ready"}}, "required": ["manifest_path"]}]},
    "s2": {"allOf": [{"$ref": "#/$defs/family"}, {"properties": {"order": {"const": 2}, "id": {"const": "S2"}, "status": {"const": "design_only"}}}]},
    "s3": {"allOf": [{"$ref": "#/$defs/family"}, {"properties": {"order": {"const": 3}, "id": {"const": "S3"}, "status": {"const": "design_only"}}}]},
    "s4": {"allOf": [{"$ref": "#/$defs/family"}, {"properties": {"order": {"const": 4}, "id": {"const": "S4"}, "status": {"const": "design_only"}}}]},
    "s5": {"allOf": [{"$ref": "#/$defs/family"}, {"properties": {"order": {"const": 5}, "id": {"const": "S5"}, "status": {"const": "design_only"}}}]},
    "s6": {"allOf": [{"$ref": "#/$defs/family"}, {"properties": {"order": {"const": 6}, "id": {"const": "S6"}, "status": {"const": "design_only"}}}]}
  }
}
